<?xml version="1.0" encoding="UTF-8"?>
<reclamations xmlns:xs="http://www.w3.org/2001/XMLSchema-instance" xs:noNamespaceSchemaLocation="greenBin.xsd">
  <reclamation id="5">
    <citoyen id="5">Michel Dubois</citoyen>
    <contenu>Odeur naus√©abonde provenant du point de collecte du quartier</contenu>
    <date>2024-01-11</date>
    <status>resolved</status>
    <type>Sanitaire</type>
  </reclamation>
  <reclamation id="6">
    <citoyen id="6">prenom nom</citoyen>
    <contenu>content</contenu>
    <date>2025-12-06</date>
    <status>resolved</status>
    <type>Sanitaire</type>
  </reclamation>
  <reclamation id="9">
    <citoyen id="9">mohamed</citoyen>
    <contenu>zebla taycha</contenu>
    <date>2025-12-12</date>
    <status>new</status>
    <type>Collecte</type>
  </reclamation>
  <reclamation id="10">
    <citoyen id="10">bouhamed</citoyen>
    <contenu>zeblaa brchaa</contenu>
    <date>2025-12-12</date>
    <status>new</status>
    <type>Collecte</type>
  </reclamation>
  <reclamation id="11">
    <citoyen id="11">daouad</citoyen>
    <contenu>zbla zbla</contenu>
    <date>2025-12-12</date>
    <status>new</status>
    <type>Collecte</type>
  </reclamation>
</reclamations>
